{
  "$schema": "https://json-schema.org/draft/2020-12/schema",
  "$id": "https://weflow.local/contracts/v1/live-evaluation-suite-report.schema.json",
  "title": "LiveEvaluationSuiteReport",
  "type": "object",
  "additionalProperties": false,
  "required": ["schema_id", "schema_version", "suite_report_id", "evaluation_session_id", "suite_id", "suite_sha256", "profile", "provider_profile_sha256", "model_id_sha256", "prompt_template_sha256", "price_profile_id", "price_profile_sha256", "task_count", "attempt_count", "attempt_ids", "all_attempts_complete", "all_hard_gates_passed", "grounded_happy_path_success_count", "accepted", "live_verified", "task_aggregates", "suite_aggregate", "capability_flags", "limitations", "report_sha256"],
  "properties": {
    "schema_id": {"const": "https://weflow.local/contracts/v1/live-evaluation-suite-report.schema.json"}, "schema_version": {"const": "v1"}, "suite_report_id": {"type": "string", "minLength": 1}, "evaluation_session_id": {"type": "string", "minLength": 1}, "suite_id": {"const": "live-pilot.v1"}, "suite_sha256": {"type": "string", "pattern": "^[a-f0-9]{64}$"}, "profile": {"const": "live-pilot.v1"}, "provider_profile_sha256": {"type": "string", "pattern": "^[a-f0-9]{64}$"}, "model_id_sha256": {"type": "string", "pattern": "^[a-f0-9]{64}$"}, "prompt_template_sha256": {"type": "string", "pattern": "^[a-f0-9]{64}$"}, "price_profile_id": {"type": "string", "minLength": 1}, "price_profile_sha256": {"type": "string", "pattern": "^[a-f0-9]{64}$"}, "task_count": {"const": 6}, "attempt_count": {"const": 30}, "attempt_ids": {"type": "array", "minItems": 30, "maxItems": 30, "uniqueItems": true, "items": {"type": "string", "minLength": 1}}, "all_attempts_complete": {"const": true}, "all_hard_gates_passed": {"const": true}, "grounded_happy_path_success_count": {"type": "integer", "minimum": 4, "maximum": 5}, "accepted": {"const": true}, "live_verified": {"const": true},
    "task_aggregates": {"type": "array", "minItems": 6, "maxItems": 6, "items": {"type": "object", "additionalProperties": false, "required": ["evaluation_task_id", "attempt_count", "success_rate", "hard_gate_rate", "token_p50", "token_p95", "token_sample_variance", "cost_p50", "cost_p95", "cost_sample_variance", "provider_latency_p50_ms", "provider_latency_p95_ms", "end_to_end_latency_p50_ms", "end_to_end_latency_p95_ms"], "properties": {"evaluation_task_id": {"type": "string", "minLength": 1}, "attempt_count": {"const": 5}, "success_rate": {"type": "number", "minimum": 0, "maximum": 1}, "hard_gate_rate": {"const": 1}, "token_p50": {"type": "number", "minimum": 0}, "token_p95": {"type": "number", "minimum": 0}, "token_sample_variance": {"type": "number", "minimum": 0}, "cost_p50": {"type": "number", "minimum": 0}, "cost_p95": {"type": "number", "minimum": 0}, "cost_sample_variance": {"type": "number", "minimum": 0}, "provider_latency_p50_ms": {"type": "number", "minimum": 0}, "provider_latency_p95_ms": {"type": "number", "minimum": 0}, "end_to_end_latency_p50_ms": {"type": "number", "minimum": 0}, "end_to_end_latency_p95_ms": {"type": "number", "minimum": 0}}}},
    "suite_aggregate": {"type": "object", "additionalProperties": false, "required": ["success_rate", "hard_gate_rate", "total_tokens", "estimated_cost", "currency", "provider_latency_p50_ms", "provider_latency_p95_ms", "end_to_end_latency_p50_ms", "end_to_end_latency_p95_ms"], "properties": {"success_rate": {"type": "number", "minimum": 0, "maximum": 1}, "hard_gate_rate": {"const": 1}, "total_tokens": {"type": "integer", "minimum": 0}, "estimated_cost": {"type": "number", "minimum": 0}, "currency": {"type": "string", "pattern": "^[A-Z]{3}$"}, "provider_latency_p50_ms": {"type": "number", "minimum": 0}, "provider_latency_p95_ms": {"type": "number", "minimum": 0}, "end_to_end_latency_p50_ms": {"type": "number", "minimum": 0}, "end_to_end_latency_p95_ms": {"type": "number", "minimum": 0}}},
    "capability_flags": {"type": "object", "additionalProperties": false, "required": ["live", "replay", "network", "model", "external_business_write", "approval", "delivery", "customer_outcome_unverified"], "properties": {"live": {"const": true}, "replay": {"const": false}, "network": {"const": true}, "model": {"const": true}, "external_business_write": {"const": false}, "approval": {"const": false}, "delivery": {"const": false}, "customer_outcome_unverified": {"const": true}}},
    "limitations": {"type": "array", "minItems": 1, "uniqueItems": true, "items": {"type": "string", "minLength": 1, "maxLength": 160}}, "report_sha256": {"type": "string", "pattern": "^[a-f0-9]{64}$"}
  }
}
