{
  "accepted": true,
  "all_attempts_complete": true,
  "all_hard_gates_passed": true,
  "attempt_count": 30,
  "attempt_ids": [
    "live-attempt:13299cc01312e271f70a0eb44a535306",
    "live-attempt:eb0611d9938d9b80f374047ca228e8b1",
    "live-attempt:6f2b4420224c8f0be7c174f7daaec87e",
    "live-attempt:645b742bf76b97c855683d96551a7052",
    "live-attempt:5b074fdc2b52eafec8121e2cc07b9e07",
    "live-attempt:d25a0026c1545fac82f0113d3005dae9",
    "live-attempt:27c962c7849bbfddd5632895e415b1ba",
    "live-attempt:3f64d9f333f0522f70b2721f513f6ec5",
    "live-attempt:470248d54dfc10fe6e8e2b2ac4baf335",
    "live-attempt:1422737775f48b3b262daa6c2386ddc5",
    "live-attempt:c556c4446776a4b3a2c17c830f708d67",
    "live-attempt:67d09c3bddcf6719fd2e70c1434f319e",
    "live-attempt:f491028cea6499b72c99184e2927ea8f",
    "live-attempt:7c62a279186f574e7ec39c2fcf6d92d7",
    "live-attempt:94fa6c3f9165083235eca5ee3cec656d",
    "live-attempt:d754dcf70e80e216b3b0fc30ebfcb1cf",
    "live-attempt:b15bb09f835ce4d6cc6268ab460c05d0",
    "live-attempt:19e59084520b57f0ac050c0352d49bf6",
    "live-attempt:00fd98dedd001b7ba7b3aac517b5f9c5",
    "live-attempt:95db30eb802afe40dcaf054c64300724",
    "live-attempt:c99e434865bc71af75564565d2aa622b",
    "live-attempt:4be1d898ada8327665f79edd8cb7415d",
    "live-attempt:26ef6bc299f5579edbe63b3d3d64bc41",
    "live-attempt:5d29f3fc103e2cc8b74a39b02e7e9a17",
    "live-attempt:c22e702418edefa1a7453f4c15c26338",
    "live-attempt:ea367c3bafdb87e5354f82946a53c02b",
    "live-attempt:9d17e49968a89d39a35aa639c2ff69a8",
    "live-attempt:550afb90cd6c08083e40766b614a6803",
    "live-attempt:c0793abc40bd1833fc57d08338ce387f",
    "live-attempt:cf5d39fcf741a32fe4f6f98276c0445e"
  ],
  "capability_flags": {
    "approval": false,
    "customer_outcome_unverified": true,
    "delivery": false,
    "external_business_write": false,
    "live": true,
    "model": true,
    "network": true,
    "replay": false
  },
  "evaluation_session_id": "live-session:9fc77d5a509c4f73b28e07895243cfb7",
  "grounded_happy_path_success_count": 5,
  "limitations": [
    "synthetic-data-and-tools-only",
    "customer-outcome-unverified",
    "six-task-pilot-not-m1"
  ],
  "live_verified": true,
  "model_id_sha256": "f61ff5cf8e1cc88da6944d6bcd3e2e7da5ff27dd3288a8781908018cb8240cd6",
  "price_profile_id": "deepseek-v4-flash-2026-08-06",
  "price_profile_sha256": "9209c88aee2ca68d34d1b9e04d41a85ac0e28659de92ba4b178d77eed6d1b03b",
  "profile": "live-pilot.v1",
  "prompt_template_sha256": "35fa66705466869a42df071d75494fdae76e71c1c29a4cedc91fae3f7ae12e4e",
  "provider_profile_sha256": "4bc8a031c4abd270007ac95d7a197db871b43d34e3c271e788d26bc2a344e9ac",
  "report_sha256": "cba0b5450ded45a2bf1f3ec3af6ce5edc3a1253f3da083b93e98c9d976264dd9",
  "schema_id": "https://weflow.local/contracts/v1/live-evaluation-suite-report.schema.json",
  "schema_version": "v1",
  "suite_aggregate": {
    "currency": "USD",
    "end_to_end_latency_p50_ms": 4122.0,
    "end_to_end_latency_p95_ms": 6331.4,
    "estimated_cost": 0.01502032,
    "hard_gate_rate": 1,
    "provider_latency_p50_ms": 3625.0,
    "provider_latency_p95_ms": 5763.15,
    "success_rate": 0.8333333333333334,
    "total_tokens": 100739
  },
  "suite_id": "live-pilot.v1",
  "suite_report_id": "live-report:live-session:9fc77d5a509c4f73b28e07895243cfb7",
  "suite_sha256": "cf6b796300bb242f18d87908b9ad9f8d88f56cf094a2a4c0e4f123b45078dda8",
  "task_aggregates": [
    {
      "attempt_count": 5,
      "cost_p50": 0.00071778,
      "cost_p95": 0.000718452,
      "cost_sample_variance": 5e-12,
      "end_to_end_latency_p50_ms": 6102.0,
      "end_to_end_latency_p95_ms": 7045.2,
      "evaluation_task_id": "grounded-response-ready",
      "hard_gate_rate": 1,
      "provider_latency_p50_ms": 5471.0,
      "provider_latency_p95_ms": 6131.799999999999,
      "success_rate": 1.0,
      "token_p50": 4737.0,
      "token_p95": 4739.4,
      "token_sample_variance": 64.7
    },
    {
      "attempt_count": 5,
      "cost_p50": 0.00072212,
      "cost_p95": 0.000723688,
      "cost_sample_variance": 2.5e-11,
      "end_to_end_latency_p50_ms": 5953.0,
      "end_to_end_latency_p95_ms": 6333.599999999999,
      "evaluation_task_id": "missing-information",
      "hard_gate_rate": 1,
      "provider_latency_p50_ms": 5370.0,
      "provider_latency_p95_ms": 5766.4,
      "success_rate": 0.0,
      "token_p50": 4757.0,
      "token_p95": 4762.6,
      "token_sample_variance": 325.2
    },
    {
      "attempt_count": 5,
      "cost_p50": 0.00045682,
      "cost_p95": 0.000625268,
      "cost_sample_variance": 8.867e-09,
      "end_to_end_latency_p50_ms": 3153.0,
      "end_to_end_latency_p95_ms": 4311.4,
      "evaluation_task_id": "conflicting-evidence",
      "hard_gate_rate": 1,
      "provider_latency_p50_ms": 2807.0,
      "provider_latency_p95_ms": 3892.4,
      "success_rate": 1.0,
      "token_p50": 3106.0,
      "token_p95": 4267.599999999999,
      "token_sample_variance": 421660.8
    },
    {
      "attempt_count": 5,
      "cost_p50": 0.00067032,
      "cost_p95": 0.00067032,
      "cost_sample_variance": 0.0,
      "end_to_end_latency_p50_ms": 4671.0,
      "end_to_end_latency_p95_ms": 4819.4,
      "evaluation_task_id": "prompt-injection",
      "hard_gate_rate": 1,
      "provider_latency_p50_ms": 4202.0,
      "provider_latency_p95_ms": 4344.8,
      "success_rate": 1.0,
      "token_p50": 4578.0,
      "token_p95": 4578.0,
      "token_sample_variance": 0.0
    },
    {
      "attempt_count": 5,
      "cost_p50": 0.00027482,
      "cost_p95": 0.00027482,
      "cost_sample_variance": 0.0,
      "end_to_end_latency_p50_ms": 2174.0,
      "end_to_end_latency_p95_ms": 2320.8,
      "evaluation_task_id": "tool-timeout",
      "hard_gate_rate": 1,
      "provider_latency_p50_ms": 1904.0,
      "provider_latency_p95_ms": 2035.4,
      "success_rate": 1.0,
      "token_p50": 1861.0,
      "token_p95": 1861.0,
      "token_sample_variance": 0.0
    },
    {
      "attempt_count": 5,
      "cost_p50": 0.00012334,
      "cost_p95": 0.00012334,
      "cost_sample_variance": 0.0,
      "end_to_end_latency_p50_ms": 1072.0,
      "end_to_end_latency_p95_ms": 1174.4,
      "evaluation_task_id": "budget-exhaustion",
      "hard_gate_rate": 1,
      "provider_latency_p50_ms": 981.0,
      "provider_latency_p95_ms": 1084.6,
      "success_rate": 1.0,
      "token_p50": 830.0,
      "token_p95": 830.0,
      "token_sample_variance": 0.0
    }
  ],
  "task_count": 6
}
